{
  "artifact_type": "revocation_status_event",
  "schema_version": "fixture-v1",
  "fixture_notice": "Non-normative public PoC fixture. This is not a proposed standard.",
  "status_event_id": "status:key:authority:revoked:2026-05-15",
  "root_program_id": "root:qrtrust-demo:2026",
  "delegated_authority_id": "authority:qrtrust-demo:merchant-web",
  "target": {
    "target_type": "trust_key",
    "key_id": "key:authority:qrtrust-demo:merchant-web:ed25519:v1"
  },
  "status": "revoked",
  "reason": "demo_fixture_authority_key_revoked",
  "effective_at": "2026-05-15T00:00:00Z",
  "signed_by": "authority:qrtrust-demo:merchant-web",
  "signature_algorithm_id": "ed25519",
  "signature_input": "canonical-json-excluding-signature",
  "signature": "_LneMkyT_eniHjvxBKcvUvaSPSaGkA2Qge6XZkHBGXcSdTYjBKeaB5v5_KH61FO3MdHamaVVdWdfRDDN94l-Bw",
  "signature_status": "ed25519-signed"
}
